42,"Reestruturar as Casas de Mediação existentes em 31 inspetorias regionais da Guarda Civil Metropolitana para promover a cultura de mediação e a solução pacífica de conflitos",7,1,6,"Reestruturação das 31 casas de mediação já existentes nas Inspetorias regionais da GCM",380886,,"31 Casas de Mediação","A proposta das Casas de Mediação contribui para que a Guarda Civil Metropolitana fortaleça sua vocação comunitária e sua relação com a sociedade. As experiências das 31 casas já em funcionamento apresentam bons resultados e sua reestruturação implica em: requalificação dos mediadores em atividades e formação dos novos mediadores pela Escola Nacional de Mediação do Ministério da Justiça (ENAM/MJ); aparelhamento das casas de mediação; implementação de um sistema de monitoramento e avaliação dos serviços prestados. A formação dos líderes comunitários e a campanha ampliarão o alcance e a efetividade da mediação nas comunidades, promovendo uma cultura de resolução extrajudicial de conflitos.","Mediação de Conflitos: é um processo autocompositivo segundo o qual as partes em disputa são auxiliadas por uma terceira parte, neutra ao conflito, sem interesse na causa, para auxiliá-las a chegar a uma composição. Este terceiro, imparcial, facilitará a negociação entre pessoas em conflito,habilitando-as a melhor compreender suas posições e a encontrar soluções que se compatibilizem aos seus interesses e necessidades.",,,,,,,
43,"Implementar as ações do Plano Juventude Viva como estratégia de prevenção à violência, ao racismo e à exclusão da juventude negra e de periferia",6,1,6,"Campanhas de mobilização da Rede Juventude Viva realizadas,  1 Portal em funcionamento na internet, Guia de Políticas Públicas da Juventude publicado,  2 unidades da Estação Juventude implantadas,  Mapa da Juventude publicado, Projetos locais de prevenção da violência nos territórios prioritários fomentados por edital,  Projetos especiais para fortalecimento e qualificação do sistema socioeducativo, Diretrizes e territórios prioritários para um conjunto de ações transversais indicadas.",33445244,"Campanhas de mobilização, 1 Portal em funcionamento na internet 2 Estações Juventude,- 1 Itinerante e 1 Complementar,  1 Guia de Políticas Públicas Mapa da Juventude Paulistana - Fase I Fomento a Projetos Especiais para fortalecimento e qualificação do sistema socioeducativo","Campanhas de mobilização,  Mapa da Juventude Paulistana - Fase 2 , Fomento a Projetos Locais via edital, Fomento a Projetos Especiais para fortalecimento e qualificação do sistema socioeducativo","Informações sobre as entregas prevista nesta meta:
%u2022 Campanhas de mobilização: as campanhas de mobilização serão realizadas por meio de eventos artísticos e esportivos, como shows, saraus, campeonatos de skate, além de campanhas publicitárias de televisão, internet e rádio contra a cultura de violência e pela prevenção da mortalidade da juventude negra e de periferia.
%u2022 Portal: criação de um Portal que tenha uma linguagem menos formal, mais plural e interativa, com a predominância de imagens, vídeos, textos
curtos e notícias. O Portal deverá fazer uma interface com o Observatório Participativo da Secretaria Nacional da Juventude.
%u2022 Guia de Políticas Públicas da Juventude: sistematiza as políticas públicas executadas no município que tem como público alvo os jovens, em nível
municipal, estadual e federal.
%u2022 Estação Juventude: a Estação Juventude é um programa do Governo Federal que tem como principal objetivo instaurar espaços públicos de atendimento à juventude visando facilitar o acesso a políticas públicas de jovens de 15 a 29 anos, além de criar redes para emancipação da juventude, em especial para jovens de territórios com dificuldades de garantia de acesso aos direitos.
%u2022 Mapa da Juventude: pesquisa quantitativa sobre o perfil e a situação da juventude paulistana e pesquisa qualitativa sobre as expectativas e os hábitos da juventude paulistana.
%u2022 Projetos Locais de prevenção da violência: a ação prevê selecionar, por meio de edital, projetos da sociedade civil que tenham como ações a prevenção da mortalidade da juventude negra e de periferia, combate ao racismo e desconstrução da cultura de violência.
%u2022 Diretrizes e territórios prioritários para um conjunto de ações transversais nos territórios prioritários: o Plano será prioritariamente implementado nos territórios da cidade com maior número de jovens negros, maiores índices de homicício contra a juventude, menor IDH, menor número de equipamentos públicos e pior situação no Sistema Intramunicipal de Direitos Humanos SIM-DH. Além das ações previstas nesta Meta, outras secretarias priorizarão os territórios onde o Plano será implantado no desenvolvimento de suas metas: Secretaria Municipal de Educação (Mais Educação); Secretaria Municipal de Desenvolvimento, Trabalho e Empreendedorismo (PRONATEC e VAI-TEC), Secretaria Municipal de Cultura (Pontos de Cultura e VAI), Secretaria Municipal de Serviços (Pontos de Iluminação Pública e Wi-Fi), Secretaria Municipal de Segurança Urbana (Capacitação da GCM); Secretaria Municipal de Saúde (Núcleos de Prevenção de Violência) e Secretaria Municipal de Coordenação de Subprefeituras (Requalificação do espaço público e melhoria de bairro). Além destes programas e ações previstas no Programa de Metas, outras também serão incluídas no Plano Juventude Viva, como o Pro Jovem e o Bolsa Trabalho. O cronograma de entrega, bem como os custos de implantação dessas ações transversais estão descritos em suas respectivas Fichas de Identidade da meta.","Plano Juventude Viva: é uma iniciativa da Secretaria Geral da Presidência da República e da Secretaria de Promoção da Igualdade Racial e reúne ações de onze Ministérios e campanhas de prevenção que visam reduzir a vulnerabilidade dos jovens à situações de violência física e simbólica, a partir da criação de oportunidades de inclusão social e autonomia; da oferta de equipamentos, serviços públicos e espaços de convivência em territórios que concentram altos índices de homicídio; e do aprimoramento da atuação do Estado por meio do enfrentamento ao racismo institucional e da sensibilização de agentes públicos para o problema. Em São Paulo a municipalização do Plano estará a cargo de treze secretarias e será monitorado pelo Comitê Gestor Juventude Viva criado por Decreto 54.511 de 25/10/2013.",,,,,,,
44,"Implementar 2 novos espaços de convivência e 8 novos serviço de proteção social a crianças e adolescentes vítimas de violência",6,1,6,"8 novos Serviços de Proteção Social a crianças e adolescentes vítimas de violência, abuso e exploração sexual e 2 novos Espaços de Convivência para crianças e adolescentes em situação de risco social e pessoal.",13000000,"8 Serviços de Proteçã,  2 Espaço de Convivência",,,"Serviço de Proteção à criança e adolescente vítima de violência: (SPVV) serviço referenciado que oferece um conjunto de procedimentos técnicos especializados por meio do atendimento social e psicossocial para atendimento às crianças e aos adolescentes vítimas de violência doméstica, abuso ou exploração sexual, bem como aos seus familiares, proporcionando-lhes condições para o fortalecimento da auto-estima, superação da situação de violação de direitos e reparação da violência vivida. Espaços de convivência para crianças e adolescentes: (ECCA) serviço que visa acolher crianças e adolescentes em situação de vulnerabilidade social, oferecendo um espaço alternativo de sociabilidade entre a rua e o território de origem da família.",,,,,,,
45,"Ampliar e modernizar 1 Centro Olímpico de Treinamento e Pesquisa e construir 1 Centro Olímpico de Iniciação e Formação",2,1,7,"1 Centro Olímpico de Treinamento e Pesquisa e 1 Centro Olímpico de Iniciação e Formação",435335000,,"2 Centros Olímpicos","Os terrenos que serão utilizados para a construção dos Centros são de administração da Secretaria Municipal de Esportes, Lazer e Recreação e atualmente são destinados para lazer e recreação.","Centro Olímpico de Treinamento e Pesquisa: Equipamento voltado ao esporte de alto rendimento, nos moldes de um clube, com foco em esportes olímpicos, tendo crianças e jovens participando das principais competições municipais, estaduais, nacionais e até internacionais, sem nenhum custo para atletas ou seus pais.
Centro Olímpico de Iniciação e Formação: Equipamento que permite o treinamento de modalidades olímpicas em suas categorias de base/formação com recurso humanos compatíveis e metodologia utilizada pelo Centro Olímpico de Treinamento e Pesquisa.",,,,,,,
46,"Criar 1 Parque de Esportes Radicais",5,1,7,"1 Parque de Esportes Radicais no Parque Dom Pedro",27000000,,"1 Parque de Esportes Radicais","O Parque de Esporte Radicais terá uma área de 30 mil m². A Secretaria Municipal de Direitos Humanos e Cidadania, por meio da Coordenadoria de Juventude, será parceira e articuladora do público-alvo para a execução da meta.","Parque de Esportes Radicais: Skate, BMX e Patins in line, nas modalidades Street, Park e Vertical, nos níveis de Lazer, Recreação e Alto Rendimento, além de um local para receber eventos relacionados.",,,,,,,
47,"Promover a prática de atividades esportivas, recreativas e de lazer por 24 horas aos finais de semanas nas 32 subprefeituras",3,1,7,"32 equipamentos funcionando com atividades no período de 24 horas nos finais de semana",30315964,"21 equipamentos contemplados","32 equipamentos contemplados","Atividades de esportes, lazer e recreação (Ex. futebol, vôlei, jogos, atividades lúdicas). A equipe de suporte contará com segurança, limpeza e monitores. A capacidade de atendimento vai variar de acordo com o tamanho do equipamento, beneficiando de 400 a 2.000 pessoas.","Revirando a Virada: abertura das unidade da Secretaria Municipal de Esportes (centro educacionais, balneários, mini balneário, estádios e parques) para 24h de esportes durante os finais de semana.",,,,,,,
48,"Requalificar 50 equipamentos esportivos",3,1,7,"50 equipamentos requalificados",61060000,"22 equipamentos requalificados","28 equipamentos requalificados","Por requalificação entende-se reforma básica e, quando possível, implantação de novos serviços e/ou equipamentos na área a ser qualificada. Há um grupo intersecretarial formado para identificar os CDCs que poderiam passar pela requalificação e para definir a integração desse Centros com equipamentos de outras áreas, como educação ou saúde, por exemplo.","Clube Desportivo da Comunidade (CDC): unidades esportivas em terrenos municipais, mas de administração indireta. A gestão do espaço é feita por entidades da comunidade local com reconhecida vocação para o trabalho esportivo, legalmente constituídos em forma de associação comunitária ou eleitos pela própria população do bairro. São menores que os equipamentos diretamente administrados pela prefeitura.
Clube Escola: tem o objetivo de oferecer ao munícipe em idade escolar a oportunidade de participar das atividades esportivas, recreativas e de
lazer, nos Clubes Esportivos Municipais.
Clubes Esportivos Municipais: estruturas públicas que oferecem diversas atividades para a saúde, bem-estar, lazer e recreação da população de todas as regiões de São Paulo.",,,,,,,
49,"Construir 5 Centros de Iniciação Esportiva (CIE)",3,1,7,"Construção de 5 Centros de Iniciação Esportiva (CIE)",15870000,,"5 Centros de Iniciação Esportiva","Os CIEs são dimensionados em três modelos que se adaptam ao tamanho do terreno. MODELO I: Prevê a construção de ginásio poliesportivo com arquibancada para 195 pessoas e área de apoio com administração, vestiários, chuveiros, enfermaria, copa, depósito e academia (2.500 m²). MODELO II: Prevê a construção de ginásio poliesportivo com arquibancada para 195 pessoas, área de apoio com administração, vestiários, chuveiros, enfermaria, copa, depósito e academia e arena poliesportiva externa (3.500 m²). MODELO III: Prevê a construção de ginásio poliesportivo com arquibancada para 195 pessoas, área de apoio com administração, vestiários, chuveiros, enfermaria, copa, depósito e academia e complexo de atletismo (7.000 m²).","CIE: O CIEs são instalações públicas multiesportivas para crianças e jovens inciarem a prática de modalidades olímpicas e paraolímpicas, localizado em áreas de vulnerabilidade social, voltados à iniciação esportiva e ao esporte de alto rendimento, estimulando a detecção de talentos e a formação de atletas.",,,,,,,
50,"Tornar acessíveis 850 mil m² de passeios públicos",2,1,8,"850 mil m2 de passeio público acessíveis pelos Programas Caminho Seguro e Rotas Turísticas",167070000,"420 mil m2 de passeios públicos acessíveis","430 mil m2 de passeios públicos acessíveis","Padronização e readequação de passeios públicos em vias estruturais, em rotas estratégicas e diante de prédios municipais, com adequações em acessibilidade e um conjunto de intervenções: implantação de rampas, colocação de piso tátil, e outras medidas, implementando novo conceito de passeio público, organizando a localização do mobiliário urbano, garantindo livre circulação de pedestre e pessoas com deficiência ou mobilidade reduzida. A execução do serviço seguirá os padrões estabelecidos pela Portaria Intersecretarial 04/SMSP/SMPED publicada em 06/2008 que estabelece diretrizes executivas para passeios públicos em concreto moldado ""in loco"".","Acessibilidade: Condição para utilização, com segurança e autonomia, total ou assistida, dos espaços mobiliários e equipamentos urbanos, das edificações, dos serviços de transportes e dispositivos, sistemas e meios de comunicação e informação, por pessoa com deficiência ou mobilidade reduzida.
Caminho Seguro: Percurso segregado da via destinado a circulação de pedestres de forma a permitir seu deslocamento com segurança e autonomia, inclusive para pessoas com deficiência e mobilidade reduzida.
Rotas Turísticas: Caminho seguro no entorno de pontos turísticos.",,,,,,,
51,"Garantir a acessibilidade para pessoas com mobilidade reduzida em 100% da frota de ônibus",6,1,8,"%u2022 Ônibus com plataforma elevatória ou veículo de piso baixo com acesso por rampa e dispositivo de sinalização sonora, tátil e visual.",,"80%","100%","Renovação da frota de ônibus realizada pela empresa contratada mediante as regras estabelecidas em contrato (pela gestora SPTrans). Todo veículo novo obrigatoriamente deve ser acessível.
* Meta viabilizada por meio do contrato de concessão do sistema municipal de transporte.","Frota Acessível: ônibus com acesso para as pessoas com mobilidade reduzida, em duas modalidades - veículos com piso baixo e rampa de acesso ou com plataforma elevatória (e.g. ""elevador"" para veículos com degraus de acesso) e com sinalização sonora, tátil e visual para acesso de pessoas com deficiência visual e auditiva.",,,,,,,
52,"Garantir a oferta de vagas a todas as crianças beneficiárias do Benefício de Prestação Continuada da Assistência Social (BPC) e seuacompanhamento nos moldes do BPC Escola",6,1,8,"Vagas garantidas e acompanhamento das crianças beneficiárias do BPC",,,,"Programa BPC na Escola tem quatro eixos principais: 1) identificar, entre os beneficiários do BPC até 18 anos, aqueles que estão na escola e aqueles que estão fora da escola; 2) identificar as principais barreiras para o acesso e a permanência na  escola das pessoas com deficiência beneficiárias do BPC; 3) desenvolver estudos e estratégias conjuntas para superação dessas barreiras; e 4) manter acompanhamento sistemático das ações e programas dos entes federados que aderirem ao programa. A meta é garantir vagas para crianças de 0 a 5 anos (dentro da governabilidade do município) e garantir o acompanhamento em todas as idades (0 a 18) pela ação intersetorial - Educação, Assistência Social, Saúde e Direitos Humanos. O Programa BPC na Escola é uma das ações previstas no Plano Nacional dos Direitos da Pessoas com Deficiência - Plano Viiver sem Limite, pactuado entre a Prefeitura de São Paulo e Governo Federal no dia 19 de Abril de 2013.","BPC: Benefício da Política de Assistência Social que garante o pagamento de 1 salário mínimo a todas as pessoas com deficiência (em qualquer idade).
BPC na Escola: tem como objetivo desenvolver ações intersetoriais, visando garantir o acesso e a permanência na escola de crianças e adolescentes com deficiência, de 0 a 18 anos, beneficiários do BPC.",,,,,,,
53,"Efetivar o funcionamento da Central de Libras",7,1,8,"Central de Libras em funcionamento.",24500000,"1 central",,"O atendimento deverá ser 24 horas e direcionado às pessoas surdas ou com deficiência auditiva e surdocegas, conforme estabelecido pela Lei 14.441/07. A Central atenderá toda a cidade e deverá proporcionar a comunicação dos munícipes surdos ou com deficiência auditiva e surdocegos nos serviços municipais a partir de modalidade presencial e virtual.","Tradução /Interpretação da Libras/Português: Serviço de mediação entre surdo ou com deficiência auditiva, usuário da Libras e o atendente do órgão público.
Guia-Interpretação: Fornecimento de Guia-Intérprete para atendimento presencial ao munícipe surdocego nos serviços municipais",,,,,,,
54,"Revitalizar os Centros de Formação e Acompanhamento à Inclusão (CEFAI), assegurando a formação de professores e o acompanhamento aos alunos com deficiência matriculados na Rede Municipal de Ensino",6,1,8,"13 CEFAIs revitalizados",1820000,"13 CEFAIs",,"A ação de revitalização prevê a modernização dos equipamentos, atualização do acervo bibliográfico, produção e aquisição de novos materiais, ações de formação continuada dos professores, desenvolvimento de técnicas para o acompanhamento e supervisão do trabalho realizado nas Salas de Apoio e Acompanhamento à Inclusão.","CEFAI: Centros de formação e Acompanhamento a Inclusão - é responsável por desenvolver ações de formação e projetos, produzir materiais, orientar e supervisionar as Salas de Apoio e Acompanhamento à Inclusão (SAAI), além de dispor de acervo bibliográfico e de disponibilizar equipamentos específicos para alunos com necessidades educacionais especiais.
SAAI: Sala de Apoio e Acompanhamento à Inclusão - atende a alunos com necessidades educacionais que podem ou não se relacionar com deficiências, limitações ou disfunções no processo desenvolvimento, assim como com situação de superdotação ou altas habilidades. Este espaço se constitui como um serviço de apoio pedagógico especializado, desenvolvido por professores especializados. A Unidade Educacional é quem requisita a instalação desta sala e disponibiliza o serviço para os alunos da própria escola ou de outras Unidades da Rede Municipal de Ensino de seu entorno, onde não exista tal atendimento.",,,,,,,
55,"Implantação de 10 residências inclusivas para pessoas com deficiência",6,1,8,"10 Residências inclusivas em funcionamento",2800000,"6 Residências Inclusivas","4 Residências Inclusivas","O público-alvo do Serviço de Acolhimento Institucional em Residência Inclusiva são jovens e adultos com deficiência, em situação de dependência, prioritariamente aqueles atendidos pelo Benefício de Prestação Continuada - BPC, que não disponham de condições de autossustentabilidade ou de retaguarda familiar e/ou que estejam em processo de desinstitucionalização de instituições de longa permanência.","Residência Inclusiva: unidade que oferta Serviço de Acolhimento Institucional, no âmbito da Proteção Social Especial de Alta Complexidade do SUAS, conforme estabelece a Tipificação Nacional dos Serviços Socioassistenciais.",,,,,,,
56,"Implantação de 5 Centros Especializados de Reabilitação (CER)",7,1,8,"05 CER em funcionamento, com quatro modalidades de reabilitação: Auditiva, Física, Intelectual e Visual",60420000,"05 CER",,,"Centro Especializado de Reabilitação: serviço de atendimento de pacientes, em todas as faixas etárias, que necessitam de tratamento especializado em reabilitação, diagnóstico, avaliação e orientação, dentro de uma estrutura adequada à sua condição física e mental.",,,,,,,
57,"Criar e efetivar a Secretaria Municipal de Promoção da Igualdade Racial",7,1,9,"Secretaria instituída e em funcionamento",,"1 Secretaria",,"A implementação da Secretaria tornará possível a institucionalização das politicas de promoção da igualdade racial tendo como instrumento o Plano Municipal da Igualdade Racial do município de São Paulo.",,,,,,,,
58,"Viabilizar a implementação das Leis Federais 10.639/2003 e 11.645/2008 que incluem no currículo oficial da rede de ensino a temática da História e Cultura Afro-Brasileira e Indígena",7,1,9,"Professores da Rede Municipal de Ensino formados",3000000,8,16,"A capacitação deverá atender os profissionais da educação inicialmente nas Diretorias Regionais de Ensino onde há uma maior concentração de população negra ou indígena.","Leis Federais 10.639/2003 e 11.645/2008: Leis que incluíram no currículo oficial da rede de ensino a obrigatoriedade da temática da História e Cultura Afro-Brasileira e Indígena.",,,,,,,
59,"Criar e efetivar a Secretaria Municipal de Políticas para as Mulheres",7,1,9,"Secretaria instituída e em funcionamento",,"1 Secretaria",,"Construir o projeto de lei, através da elaboração do organograma, da exposição de motivos e da minuta do projeto, que irá propor a criação da Secretaria Municipal de Políticas para as Mulheres para a Câmara dos Vereadores.",,,,,,,,
60,"Reestruturar os 5 Centros de Cidadania da Mulher, redefinindo suas diretrizes de atuação",6,1,9,"5 Centros de Cidadania da Mulher reestruturados",1115707,,"5 Centros de Cidadania","A reestruturação consiste em reformular as atividades realizadas no espaço, formar e capacitar as gestoras para que os Centros cumpram a proposta de favorecer o processo de reflexão coletiva sobre a situação e a condição das mulheres com vistas a estimular a análise e o debate sobre a desigualdade entre os gêneros e os caminhos para a sua superação, através do empoderamento e da construção da autonomia das mulheres.
Pretende-se, com isso, que estes Centros sejam espaços, primordialmente, que desenvolvam, implementem e apoiem programas e projetos voltados à construção da autonomia econômica das mulheres, inclusive em áreas que não são consideradas tradicionalmente femininas.","Centros de Cidadania da Mulher (CCM): equipamento público que se constitui como espaço de qualificação e formação da cidadania ativa, no qual as mulheres podem se organizar para defender seus direitos sociais, econômicos e culturais, propor e participar de ações e projetos que estimulem a implementação de políticas de igualdade e potencializar, por meio do controle social, os serviços públicos existentes, de tal modo a atender a suas necessidades e da sua comunidade, com vistas a superação das desigualdades de gênero.",,,,,,,
