"id","name","articulation_id","axis_id","objective_id","will_be_delivered","total_cost","schedule_2013_2014","schedule_2015_2016","observation","technically","status","qualitative_progress_1","qualitative_progress_2","qualitative_progress_3","qualitative_progress_4","qualitative_progress_5","qualitative_progress_6"
1,"Inserir aproximadamente 280 mil famílias com renda de até meio salário mínimo no Cadastro Único para atingir 773 mil famílias cadastradas",6,1,1,"280 mil famílias inscritas no Cadastro Único",103305927,"228.000 famílias cadastradas","52.000 famílias cadastradas","Prioridade para implementação das ações nas Subprefeituras com maior concentração de famílias em situação de extrema pobreza e pobreza. Busca Ativa apoiada pelas áreas de interface e sociedade civil. Disponibilização de espaços públicos e equipamentos municipais para ações cadastrais.","Cadastro Único para Programas Sociais do Governo Federal (Cadastro Único): é um instrumento que identifica e caracteriza as famílias de baixa renda (renda mensal de até meio salário mínimo por pessoa ou renda mensal total de até três salários mínimos). Ele é utilizado por mais de 15 programas sociais do Governo Federal, como o Bolsa Família, Minha Casa Minha Vida, PRONATEC, Tarifa Social de Energia Elétrica, Brasil Carinhoso, etc. Busca Ativa: estratégia do Plano Brasil Sem Miséria que tem como objetivo levar o Estado ao cidadão, sem esperar que as pessoas mais pobres cheguem até o poder público. Um dos grandes desafios do Brasil Sem Miséria é alcançar aqueles que não acessam os serviços públicos e vivem fora de qualquer rede de proteção social.",,,,,,,
2,"Beneficiar 228 mil novas famílias com o Programa Bolsa Família",6,1,1,"Pagamento dos benefícios do Programa Bolsa Família viabilizado",,"171.000 Famílias beneficiadas","57.000 Famílias beneficiadas","A Secretaria Municipal de Assistência e Desenvolvimento Social faz toda a mobilização necessária e executa o cadastramento que viabiliza o pagamento dos benefícios do Programa Bolsa Família (articulação com outras Secretarias e agentes, capacitações, divulgações etc).","Programa Bolsa Família: O Programa Bolsa Família (PBF) é um programa de transferência direta de renda que beneficia famílias em situação de pobreza e de extrema pobreza em todo o País. O Bolsa Família integra o Plano Brasil Sem Miséria (BSM). Linha da extrema Pobreza: renda familiar per capita inferior a R$ 70 mensais. Linha da pobreza: renda familiar per capita entre R$ 70 e R$ 140 mensais.",,,,,,,
3,"Implantar 60 Centros de Referência de Assistência Social - CRAS",6,1,1,"60 CRAS em funcionamento",14532500,"25 CRAS","35 CRAS","Os CRAS serão construídos ou adaptados em imóveis alugados ou cedidos. Eles serão dotados de estrutura física com garantia de acessibilidade, estrutura administrativa e recursos humanos, e cada unidade terá a capacidade de referenciar até 5 mil famílias.","Centro de Referência de Assistência Social - CRAS: unidade estatal de proteção social básica do Sistema Único de Assistência Social - SUAS, que tem o objetivo de assegurar a proteção integral à famílias em situação de vulnerabilidade social.",,,,,,,
4,"Implantar 7 Centros de Referência Especializada de Assistência Social - CREAS",6,1,1,"7 CREAS em funcionamento",2184500,"4 CREAS","3 CREAS","A definição da meta - 7 unidades - responde à diretriz de garantir um equipamento em cada subprefeitura da cidade. Os CREAS serão construidos ou adaptados em imóveis alugados ou cedidos. Eles terão estrutura física adequada para acolher e garantir o atendimento e condições de privacidade, sigilo e dignidade (recepção, sala de atendimento individual e em grupo, sala para administração, banheiros, copa, espaço externo, almoxarifado). A capacidade de atendimento será de aproximadamente 80 famílias/indivíduos mês por unidade.","Centro de Referência Especializado de Assistência Social - CREAS: unidade pública e estatal, que oferta serviços especializados e continuados a famílias e indivíduos em situação de ameaça ou violação de direitos (violência física, psicológica, sexual, tráfico de pessoas, cumprimento de medidas socioeducativas em meio aberto, dentre outros).",,,,,,,
5,"Garantir 100 mil vagas do Programa Nacional de Acesso ao Ensino Técnico e Emprego (PRONATEC)",6,1,1,"100 mil vagas pactuadas com o Governo Federal",,"40.000 vagas","60.000 vagas","Publico-alvo: Beneficiários dos programas de transferência de renda, alunos de Educação de Jovens e Adultos (EJA) inscritos no Cadastro Único e beneficiários do Seguro Desemprego. Um Grupo de Trabalho intersecretarial definirá diretrizes de execução levando em conta as necessidades específicas de populações mais vulneráveis como: juventude (observando os critérios de territórios prioritários do Plano Juventude Viva, descrito em meta específica sobre o tema), mulheres vítimas de violência, negros, índios, transsexuais, população de rua e pessoas com deficiência. O planejamento já prevê 4.000 vagas para famílias em situação de rua, conforme explicado em meta específica sobre o tema.","PRONATEC: Programa Nacional de Acesso ao Ensino Técnico e Emprego criado pelo Governo Federal, em 2011, com o objetivo de ampliar a oferta de cursos de educação profissional e tecnológica.",,,,,,,
6,"Formalizar aproximadamente 22.500 microempreendedores individuais",6,1,1,"22.500 microempreendedores individuais formalizados",8721206,"10.450 microempreendedores individuais","12.050 microempreendedores individuais","O Centro de Apoio ao Trabalho (CAT) realiza sobretudo atendimentos relacionados à intermediação de mão de obra. Porém, dentro da perspectiva de geração de renda, a formalização de micro empreendedores individuais se configura em uma nova modalidade de formalização de agentes econômicos, direcionada aos trabalhadores autônomos e que não se enquadram nos vínculos empregatícios estipulados pela CLT. Esta nova modalidade tem por objetivo a formalização e a promoção de cursos e palestras nos CAT. O público atendido prioritariamente nesses espaços referese àquele considerado de alta vulnerabilidade. Serão definidas diretrizes específicas para definição de público-alvo, levando em conta recortes de gênero, juventude, étnico-racial e pessoas com deficiência.","Microempreendedor Individual (MEI): é a pessoa que trabalha por conta própria e que se legaliza como pequeno empresário. É necessário faturar no máximo até R$ 60 mil por ano e não ter participação em outra empresa como sócio ou titular. O MEI também pode ter um empregado contratado que receba o salário mínimo ou o piso da categoria.",,,,,,,
7,"Ampliar em 20 mil o número de matrículas na Educação de Jovens e Adultos e implantar 3 novos Centros Integrados (CIEJA)",6,1,1,"3 CIEJAs instalados e 20.000 novas vagas de EJA abertas no município",3030198,"1 CIEJA implantado, 12.600 vagas de EJA criadas","2 CIEJAs implantados, 7.400 vagas de EJA criadas","Está em elaboração uma proposta de reorientação curricular que articule a educação escolar com o mundo do trabalho, da cultura e a pratica social, bem como os diferentes atendimentos oferecidos na modalidade EJA: Noturno, modular, CIEJA, CMCT e MOVA. O custo da meta apresentado refere-se à instalação dos 3 novos CIEJAs e o custo das 20 mil novas vagas no período de 1 ano.","EJA: Educação de Jovens e Adultos
CIEJA: Centro Integrado de Educação de Jovens e Adultos
MOVA: Movimento de Alfabetização
CMCT: Centro Municipal de Capacitação eTreinamento",,,,,,,
8,"Implantar 5 Centros de Referência Especializados para a população em situação de rua (Centros POP)",5,1,1,"5 Centros PopRua em funcionamento",1000000,"5 Centros PopRua",,"Os Centros PopRua fazem parte do Plano Municipal da Política da População em Situação de Rua. O conjunto integrado de ações e entregas desse Plano, incluindo a implantação dos 5 Centros PopRua serão monitorados pelo Comitê Intersetorial criado pelo Decreto n. 53.795/2013.","População em situação de rua: grupo populacional heterogêneo que possui em comum a pobreza extrema, os vínculos familiares interrompidos ou fragilizados e a inexistência de moradia convencional regular, e que utiliza os logradouros públicos e as áreas degradadas como espaço de moradia e de sustento, de forma temporária ou permanente, bem como as unidades de acolhimento para pernoite temporário ou como moradia provisória (definição dada pelo Decreto
Presidencial nº 7053/2009).
Centros PopRua: Centro de Referência Especializado com rede de atendimento socioassistencial voltado à população adulta, oferecendo: abordagens sistemáticas nas ruas e encaminhamentos para os núcleos de serviços de convivência e centros de acolhida.",,,,,,,
9,"Implantar 2 restaurantes comunitários",5,1,1,"2 Restaurantes comunitários implantados",620000,"2 restaurante comunitário",,"A implantação dos restaurantes comunitários visa garantir segurança alimentar à população em situação de rua e faz parte do Plano Municipal da Política da População em Situação de Rua. Essa ação, assim como o conjunto integrado de ações e entregas do Plano será monitorada pelo Comitê Intersetorial criado pelo Decreto n. 53.795/2013.","Restaurante comunitário: tem a finalidade de servir refeições adequadas para pessoas adultas em situação de rua de forma continuada. Deverá oferecer refeições prontas, saudáveis e de qualidade. Com atendimento prioritário aos grupos da população que se encontram em situação de insegurança alimentar contribui para a
melhoria da saúde e qualidade de vida.",,,,,,,
10,"Implantar 22 Serviços de Acolhimento Institucional à população em situação de rua",5,1,1,"22 Serviços de Acolhimento Institucional implantados",6763025,"13 Serviços de Acolhimento","9 Serviços de Acolhimento","A implantação dos serviços de acolhimento compõe o Plano Municipal da Política da População em Situação de Rua e será monitorado em conjunto com as demais ações do Plano pelo Comitê Intersetorial criado pelo Decreto n. 53.795/2013, em consonância com a Politica Nacional de População de Rua. O atendimento prestado deve ser personalizado e em pequenos grupos e favorecer o convívio familiar e comunitário, bem como a utilização de serviços disponíveis na comunidade local. As regras de gestão e de convivência deverão ser construídas de forma participativa e coletiva, a fim de assegurar a autonomia dos usuários, conforme perfis. Serão 12 serviços para atendimento às famílias, 8 para atendimento a adultos de ambos os sexos e 2 para carroceiros.","Serviço de Acolhimento Institucional: acolhimento em diferentes tipos de equipamentos, destinado a famílias e/ou indivíduos com vínculos familiares rompidos ou fragilizados, a fim de garantir proteção integral. A organização do serviço deverá garantir privacidade, o respeito aos costumes, às tradições e à diversidade de: ciclos de vida, arranjos, raça/etnia, gênero e orientação sexual.",,,,,,,
11,"Implantar 12 novos Consultórios na Rua com tratamentos odontológicos e relacionados ao abuso de álcool e outras drogas",6,1,1,"12 consultórios na rua em funcionamento com equipes multidisciplinares",24000000,"12 Consultórios na Rua",,,"Consultório na rua: equipes de saúde móveis para atender à população em situação de risco e vulnerabilidade social, principalmente crianças e adolescentes e usuários de álcool e outras drogas.",,,,,,,
12,"Promover ações para a inclusão social e econômica da população em situação de rua",5,1,1,"Campanha de conscientização da população sobre os direitos e vulnerabilidades sociais da população em situação de rua, acesso de pelo menos 4.000 pessoas em situação de rua ao PRONATEC ou outros programas de qualificação profissional, promovendo ingresso ao mercado de trabalho, 2.000 habitações construídas e/ou reformadas por meio do MCMV ou outros programas habitacionais de interesse social e  articulação para empregabilidade da população em situação de rua, mediante projetos de integração e promoção social e econômica incluídos nos grandes eventos da cidade.",3142313,"1 Campanha de Conscientização, 2 projetos de integração social e econômica, 2.000 vagas em cursos profissionalizantes - PRONATEC, 1.000 unidades habitacionais MCMV entregues","1 Campanha de Conscientização, 2 projetos de integração social e econômica, 2.000 vagas em cursos profissionalizantes - PRONATEC, 1.000 unidades habitacionais MCMV entregues","A política de garantia de direitos da população em situação de rua será tratada como uma das prioridades da gestão na ótica da garantia de
direitos humanos. Para isso, foi criada no âmbito da Secretaria de Direitos Humanos e Cidadania a Coordenação de Políticas para População em Situação de Rua que tem por objetivo articular a gestão transversal das ações públicas voltadas a esta comunidade, pautada na ampliação do diálogo com organizações da sociedade civil e movimentos sociais. Assim, a necessidade da criação de um colegiado, o Comitê Intersetorial da Política Municipal para a População em Situação de Rua (Comitê PopRua) para contribuir na criação do Plano Municipal desta políticas com ênfase na promoção da cidadania, no respeito dos direitos humanos, combate a todas as formas de discriminação e preconceito e à valorização da diversidade. O Plano Municipal da Política da População em Situação de Rua e seu conjunto integrado de ações e entregas serão monitorados por esse Comitê Intersetorial, criado pelo Decreto n. 53.795/2013. No custo total dessa meta não estão incluídos os dados de custo das Unidades Habitacionais e das vagas do PRONATEC. Tais custos estão incorporados nas fichas específicas de cada uma dessas metas.","População em situação de rua: Considera-se população em situação de rua o grupo populacional heterogêneo que possui em comum a pobreza extrema, os vínculos familiares interrompidos ou fragilizados e a inexistência de moradia convencional regular, e que utiliza os logradouros públicos e as áreas degradadas como espaço de moradia e de sustento, de forma temporária ou permanente, bem como as unidades de acolhimento para pernoite temporário ou como moradia provisória"" (definição dada pelo Decreto Presidencial nº 7053/2009).",,,,,,,
13,"Implementar 4 Centros de Referência em Segurança Alimentar e Nutricional e desenvolver ações de apoio à agricultura urbana e periurbana",4,1,1,"04 Centros de Referência de Segurança Alimentar e Nutricional e ações municipais de apoio à agricultra urbana e periurbana",10000000,"1 CRSAN","3 CRSAN","Os Centros de Referência de Segurança Alimentar e Nutricional são equipados com cozinha experimental, biblioteca, espaços multimídia (salas de aula)
e anfiteatro.","Centro de Referência em Segurança Alimentar e Nutricional (CRSAN): equipamento público onde se desenvolvem atividades de formação e assessoria para pessoas que atuam em programas relacionados aos Direitos Humanos e à Alimentação Adequada como merendeiras, nutricionistas, assistentes sociais, agentes comunitários de saúde e entidades assistenciais.",,,,,,,
14,"Valorizar o profissional da educação por meio da implantação de 31 polos da Universidade Aberta do Brasil (UAB)",3,1,2," 31 polos da UAB instalados nos CEUs",3485000,"31 polos da UAB",,"Os pólos de apoio presencial são as unidades operacionais para o desenvolvimento descentralizado de atividades pedagógicas e administrativas relativas aos cursos e programas ofertados à distância pelas instituições públicas de ensino superior no âmbito do Sistema UAB. Mantidos por Municípios ou Governos de Estado, os pólos oferecem a infraestrutura física, tecnológica e pedagógica para que os alunos possam acompanhar os cursos a distância. Os CEUs Rosa da China e Sapopemba (jurisdicionados à Subprefeitura de Sapopemba) atenderão também o público da Subprefeitura da Vila Prudente que não conta com unidades CEU.","Universidade Aberta do Brasil (UAB): Sistema UAB funciona como articulador entre as instituições de ensino superior e os governos estaduais e municipais, com o objetivo de atender às demandas locais por educação superior.",,,,,,,
15,"Ampliar a jornada escolar de 100 mil alunos da Rede Municipal de Ensino",6,1,2,"435 módulos de jornada extendida implantados e em funcionamento que atenderão 100 mil alunos",37447630,"50 mil alunos atendidos, 218 módulos implantados","50 mil alunos atendidos, 217 módulos implantados","Os módulos do Programa Mais Educação são voltados à educação básica e visam a ampliação da permanência do aluno na escola participando de atividades de acompanhamento pedagógico ligadas ao meio ambiente, lazer e esporte, cultura e artes, cultura digital e outras áreas. Cada módulo atende a 230 alunos que passam a contar com o período extendido da jornada escolar em suas unidades de ensino. A adesão ao programa depende da aprovação do plano de trabalho apresentado pelas Unidades Escolares ao MEC. As atividades previstas nos planos de trabalho visam a extensão da jornada escolar diária para 7 horas, com atividades complementares vinculadas à proposta pedagógica. O custo total da meta representa o valor necessário para manter o Programa Mais Educação para 100 mil alunos durante o período de um ano.","Programa Mais Educação: instituído pela Portaria Interministerial n.º 17/2007, integra as ações do Plano de Desenvolvimento da Educação (PDE) como uma estratégia do Governo Federal para induzir a ampliação da jornada escolar e a organização curricular, na perspectiva da Educação Integral. Módulo: O programa é desenvolvido em módulos, sendo que cada módulo atenderá um grupo de 230 alunos.",,,,,,,
16,"Ampliar a Rede CEU em 20 unidades, expandindo a oferta de vagas para a educação infantil",3,1,2,"20 unidades da Rede CEU implantadas",620000000,"1 CEU","19 CEUs","Cada nova unidade da Rede CEU contará com 1 CEMEI, 1 EMEF, quadra poliesportiva, teatro, playground, piscinas, biblioteca, telecentro e espaços para oficinas, ateliês e reuniões. Os espaços serão abertos à comunidade, inclusive aos finais de semana. Com a ampliação, a Rede CEU passará das 45 unidades em 2012 para 65 unidades em 2016. A diretriz fundamental que orienta a escolha das áreas é a identificação dos territórios com maior vulnerabilidade social e menor demanda atendida.","Rede CEU: Centro Educacional Unificado que se constitui em um complexo educacional, esportivo e cultural caracterizado como espaço público múltiplo.",,,,,,,
17,"Obter terrenos, projetar, licitar, licenciar, garantir a fonte de financiamento e construir 243 Centros de Educação Infantil",5,1,2,"243 CEIs implantados",1280547630,"31 creches","212 creches","A meta será atingida com a construção de novos equipamentos com recursos do município e de parcerias com o Governo do Estado de São Paulo e com o Governo Federal. A política de expansão de vagas em creches é estruturada como um direito das crianças e das mulheres, articulada ao Programa Brasil Carinhoso e a um projeto educacional comprometido com uma educação não-sexista, não-racista e não-homofóbica. O cumprimento da meta gerará aproximadamente 53 mil novas vagas.","Centro de Educação Infantil: unidade de educação municipal para
crianças de 0 a 3 anos de idade",,,,,,,
18,"

Construir 65 Escolas Municipais de Educação Infantil (EMEIs) e um Centro Municipal de Educação Infantil (CEMEI)",6,1,2,"65 EMEIs e 1 CEMEI implantados",295714464,"18 EMEIs","47 EMEIs, 1 CEMEI","A meta será atingida com a construção de novos equipamentos com recursos do município e em parceria com o Governo do Estado de São Paulo. A política de expansão de vagas em creches é estruturada como um direito das crianças e das mulheres, articulada ao Programa Brasil Carinhoso e a um projeto educacional comprometido com uma educação não-sexista, não-racista e não-homofóbica. O cumprimento da meta gerará a abertura de cerca de 30 mil novas vagas.","EMEI: Escola Municipal de Educação Infantil: unidade de educação municipal para crianças de 4 a 5 anos de idade.
CEMEI: Centro Municipal de Educação Infantil: unidade de educação municipal para crianças de 0 a 5 anos de idade.",,,,,,,
19,"

Expandir a oferta de vagas para educação infantil por meio da rede conveniada e outras modalidades de parcerias",6,1,2,"52 mil novas vagas para educação infantil na rede conveniada e por outras modalidades de parcerias",306263135,"22 mil vagas criadas","30 mil vagas criadas","A Rede Conveniada representa os convênios firmados com instituições não governamentais para operação e manutenção das unidades municipais. Pretende-se ainda firmar acordos e parcerias com empresas privadas, em observância ao estabelecido no art. 389 § 2º da CLT, e ainda outras parcerias como PPPs. A política de expansão de vagas em creches é estruturada como um direito das crianças e das mulheres, articulada ao Programa Brasil Carinhoso e a um projeto educacional comprometido com uma educação não-sexista, não-racista e não-homofóbica. O custo total da meta refere-se à manutenção de 52 mil vagas para educação infantil por meio da rede conveniada e outras modalidades de parcerias durante o período de 1 ano.","Rede Conveniada: Instituições não governamentais que oferecem o serviço de educação infantil.
Parcerias: Convênios e acordos com empresas privadas e Parcerias Publico Privadas- PPP.",,,,,,,
20,"

Instalar 32 unidades da Rede Hora Certa distribuídas em cada uma das Subprefeituras",6,1,3,"32 unidades da Rede Hora Certa instaladas com ambulatório de especialidades",224000000,"15 unidades da Rede Hora Certa","17 unidades da Rede Hora Certa","A Rede Hora Certa compõe a atenção ambulatorial especializada definida como um conjunto de ações e serviços que visam atender aos principais problemas de saúde e agravos da população. É necessária a disponibilidade de profissionais especializados de nível superior e médio para a realização dos procedimentos tais como: cirurgia ambulatoriais, procedimentos traumato-ortopédicos, ações especializadas em odontologia, citopatologia, radiodiagnóstico, exames ultrassonográficos e outros. O principal objetivo da Rede Hora Certa é conseguir reduzir o tempo de espera para exames, consultas e procedimentos especializados, incluindo as cirurgias eletivas.","Rede Hora Certa: serviços de atenção ambulatorial especializada com recursos tecnológicos de apoio diagnóstico e terapêutico e procedimentos cirúrgicos de pequeno e médio porte.",,,,,,,
21,"Desenvolver o processo de inclusão do módulo do prontuário eletrônico do paciente (PE) na rede municipal de saúde, integrada ao Sistema SIGA",5,1,3,"Prontuário eletrônico do paciente com o registro da história clínica, exame físico, medicamentos, resultado de exames clínicos, procedimentos, dentre outros, implantados em todos os serviços ambulatoriais e hospitalares com a informatização dos consultórios de cada serviço.",105000000,"Projeto Prontuário eletrônico finalizado e finalização da pré implantação","Prontuário eletrônico do paciente implantado","A inclusão do módulo prontuário eletrônico do paciente no SIGA disponibiliza as informações em tempo real para o planejamento e acompanhamento de atividades para a implantação de novos modelos assistenciais; aperfeiçoa a organização do processo de trabalho assistencial, possibilitando subsídios para a agilização de tomadas de decisão clínica e melhoria na qualidade assistencial; integra as atividades administrativas e assistenciais, permitindo redução de custos; utiliza o Cartão Nacional de Saúde como elemento integrador dos diversos níveis do sistema. O prontuário eletrônico deve estar de acordo com as orientações e determinações da Resoluções CFM Nº 1821/2007, 1638/2002.","Prontuário eletrônico do paciente: é o repositório de informações a respeito da saúde do indivíduo, de forma processável eletronicamente.
SIGA: Sistema Integrado de Gestão e Assistência à Saúde",,,,,,,
22,"Obter terrenos, projetar, licitar, licenciar, garantir a fonte de financiamento e construir 3 novos hospitais, ampliando em 750 o número de leitos do sistema municipal de saúde",6,1,3,"3 hospitais em funcionamento",603500000,,"3 novos hospitais","Construção de 3 hospitais, com 250 leitos cada um, sendo eles:
- Hospital Municipal de Parelheiros;
- Hospital Municipal Brasilândia;
- Construção de um novo Hospital em substituição ao Hospital Municipal Alexandre Zaio, no mesmo local.
Com essas construções busca-se aumentar o número e a qualidade dos atendimentos à população, através de ambientes mais propícios a um atendimento
acolhedor e humanizado.","Hospital: unidade de saúde que busca oferecer atendimento à população no diagnóstico e tratamento em ambientes de internação acolhedores e humanizados",,,,,,,
